<?xml version="1.0" encoding="utf-8"?>
<strings xmlns:xsi="http://www.w3.org/2001/XMLSchema-instance"
         xsi:noNamespaceSchemaLocation="../../strings.xsd">
    <!-- -->
    <string id="30000">Question %d sur %d</string>
    <string id="30001">Score :</string>
    <string id="30002">Question value:</string>
    <string id="30003">Fin du Quiz</string>
    <string id="30004">Votre score %d sur %d</string><!-- 1st %d is score, 2nd %d is total question -->

    <string id="30005">Specials</string><!-- same value as id="20381" in main xbmc strings.xml -->
    <string id="30006">Saison %i</string><!-- same value as id="20358" in main xbmc strings.xml -->
    <string id="30007">%d %B %Y</string><!-- episode first aired date format: http://docs.python.org/library/time.html#time.strftime -->

    <string id="30008">[B]Chargement en cours[/B]</string>

    <!-- Menu -->
    <string id="30100">Quiz de Films</string>
    <string id="30101">Quiz de Séries TV</string>
    <string id="30102">Paramètres</string>
    <string id="30103">Quitter</string>

    <string id="30110">[B]Collection de films[/B]</string>
    <string id="30111">%d films</string><!-- %d is movie count -->
    <string id="30112">%d acteurs</string><!-- %d is actor count -->
    <string id="30113">%d réalisateurs</string><!-- %d is director count -->
    <string id="30114">%d studios</string><!-- %d is studio count -->
    <string id="30115">%d heures de divertissement</string>

    <string id="30120">[B]Collection de Séries TV[/B]</string>
    <string id="30121">%d Séries TV</string><!-- %d is TV show count -->
    <string id="30122">%d saisons</string><!-- %d is season count -->
    <string id="30123">%d épisodes</string><!-- %d is episodes count -->

    <!-- Movie Questions -->
    <string id="30400">Quel est ce film ?</string>
    <string id="30401">Dans quel film [B]%s[/B] ne joue pas ?</string><!-- %s is actor name -->
    <string id="30402">En quelle année [B]%s[/B] est sortie ?</string><!-- %s is movie title -->
    <string id="30403">Quel est le slogan du film [B]%s[/B] ?</string><!-- %s is movie title -->
    <string id="30404">Qui a réalisé [B]%s[/B] ?</string><!-- %s is movie title -->
    <string id="30405">Quel studio a produit [B]%s[/B] ?</string><!-- %s is movie title -->
    <string id="30406">Quel est cet acteur ?</string>
    <string id="30407">Qui joue le personnage de [B]%s[/B] dans [B]%s[/B] ?</string><!-- 1st %s is role, 2nd %s is movie title -->
    <string id="30408">Qui fait la voix de [B]%s[/B] dans [B]%s[/B] ?</string><!-- 1st %s is role, 2nd %s is movie title -->
    <string id="30409">De quel film provient cet extrait ?</string>
    <string id="30410">Quel film est le plus récent ?</string>
    <string id="30411">Quel film n'est pas réalisé par [B]%s[/B] ?</string><!-- %s is director name -->
    <string id="30412">Quel acteur joue dans ces films ?</string>
    <string id="30413">Quel acteur joue dans [B]%s[/B] aux côtés de [B]%s[/B] ?</string><!-- 1st %s is movie title, 2nd %s is actor name -->
    <string id="30414">Quel film est le plus long ?</string>

    <!-- TV show Questions -->
    <string id="30450">Quelle est cette Série TV ?</string>
    <string id="30451">Quelle est cette saison de [B]%s[/B] ?</string><!-- %s is tvshow title -->
    <string id="30452">Quel est cet épisode de [B]%s[/B] ?</string><!-- %s is tvshow title -->
    <string id="30453">Quand l'épisode [B]%s[/B] de [B]%s[/B] a été diffusée pour la première fois ?</string><!-- 1st %s is episode, 2nd %s is tvshow title -->
    <string id="30454">Quand la Série TV [B]%s[/B] a été diffusée pour la première fois ?</string><!-- %s is tvshow title -->
    <string id="30455">Qui joue le rôle de [B]%s[/B] dans [B]%s[/B] ?</string><!-- 1st %s is role, 2nd %s is tvshow title -->
    <string id="30456">Qui fait la voix de [B]%s[/B] dans [B]%s[/B] ?</string><!-- 1st %s is role, 2nd %s is tvshow title -->

    <!-- Settings strings -->
    <string id="30500">Général</string>
    <string id="30501">Films</string>
    <string id="30502">Séries TV</string>
    <string id="30503">Téléchargements</string>
    <string id="30504">Meilleurs scores</string>
    <string id="30505">Questions</string>

    <string id="30510">Limiter le nombre de questions</string>
    <string id="30511">Limite de Questions</string>
    <string id="30512">Limiter la sélection des films par rapport au contrôle parental</string>
	<string id="30513">Max. MPAA rating</string>
    <string id="30514">Affiche la bonne réponse quand la votre est incorrecte</string>
    <string id="30515">Prendre seulement les films déjà vus pour le Quiz</string>
    <string id="30516">Limiter la sélection des série TV par rapport au contrôle parental</string>
	<string id="30517">Max. Content rating</string>
    <string id="30519">Télécharger sur IMDB...</string>
    <string id="30520">Téléchargement des données d'IMDB...</string>
    <string id="30521">%d sur %d Mo.</string>
    <string id="30522">Certaines questions requièrent plus d'informations,</string>
    <string id="30523">vous pouvez les télécharger ci-dessous :</string>
    <string id="30524">Pseudo</string>

    <!-- Game type strings -->
    <string id="30600">[B]Choisissez un Quiz de Films[/B]</string>
    <string id="30601">[B]Choisissez un Quiz de Séries TV[/B]</string>
    <string id="30602">Illimité</string>
    <string id="30603">Limite de Temps</string>
    <string id="30604">Limite de Questions</string>
    <string id="30605">Annuler</string>
    <string id="30606">Jouer</string>

    <string id="30610">Pas de limite de temps</string>
    <string id="30611">Pas de limite de questions</string>
    <string id="30612">Arréter le Quiz en utilisant Quitter</string>
    <string id="30613">Le Quiz s'arrête après</string>

    <!-- Game over strings -->
    <string id="30700">[B]Fin du Quiz[/B]</string>
    <string id="30701">Recommencer</string>
    <string id="30702">Meilleurs Scores</string>
    <string id="30703">Meilleurs Scores locaux</string>
    <string id="30704">Menu général</string>



    <string id="39999">Traduit par DanoneKiD</string>
</strings>