<?xml version="1.0" encoding="utf-8"?>
<strings xmlns:xsi="http://www.w3.org/2001/XMLSchema-instance"
         xsi:noNamespaceSchemaLocation="../../strings.xsd">
    <!-- -->
    <string id="30000">Въпрос %d от %d</string>
    <string id="30001">Правилни:</string>
    <string id="30002">Грешни:</string>
    <string id="30003">Играта приключи</string>
    <string id="30004">Вие отблязахте %d от %d</string><!-- 1st %d is score, 2nd %d is total question -->

    <string id="30005">Спешъли</string><!-- same value as id="20381" in main xbmc strings.xml -->
    <string id="30006">Сезон %i</string><!-- same value as id="20358" in main xbmc strings.xml -->
    <string id="30007">%B %e, %Y</string><!-- episode first aired date format: http://docs.python.org/library/time.html#time.strftime -->
    <string id="30008">[B]Зарежда...[/B]</string>

    <!-- Menu -->
    <string id="30100">Игра с Филми</string>
    <string id="30101">Игра със Сериали</string>
    <string id="30102">Настройки</string>
    <string id="30103">Изход</string>

     <string id="30110">[B]Любопитни факти от филми[/B]</string>
    <string id="30111">%d филма</string><!-- %d is movie count -->
    <string id="30112">%d актьора</string><!-- %d is actor count -->
    <string id="30113">%d режисьора</string><!-- %d is director count -->
    <string id="30114">%d студиа</string><!-- %d is studio count -->
    <string id="30115">%d часа забавления</string>

    <string id="30120">[B]Любопитни факти от сериали[/B]</string>
    <string id="30121">%d TV сериали</string><!-- %d is TV show count -->
    <string id="30122">%d сезона</string><!-- %d is season count -->
    <string id="30123">%d епизода</string><!-- %d is episodes count -->

    <!-- Movie Questions -->
    <string id="30400">Кой филм е това?</string>
    <string id="30401">В кой филм [B]%s[/B] не участва?</string><!-- %s is actor name -->
    <string id="30402">Коя година [B]%s[/B] е издаден?</string><!-- %s is movie title -->
    <string id="30403">Кой лозунг принадлежи на [B]%s[/B]?</string><!-- %s is movie title -->
    <string id="30404">Кой режисира [B]%s[/B]?</string><!-- %s is movie title -->
    <string id="30405">Кое студио издава [B]%s[/B]?</string><!-- %s is movie title -->
    <string id="30406">Кой актьор е това?</string>
    <string id="30407">Кой играе [B]%s[/B] в [B]%s[/B]?</string><!-- 1st %s is role, 2nd %s is movie title -->
    <string id="30408">Кой озвучава [B]%s[/B] в [B]%s[/B]?</string><!-- 1st %s is role, 2nd %s is movie title -->
    <string id="30409">От кой филм е цитатът?</string>
    <string id="30410">Кой е най-новият филм?</string>
    <string id="30411">Кой филм не е режисиран от [B]%s[/B]?</string><!-- %s is director name -->
    <string id="30412">Кой актьор участва в тези филми?</string>
    <string id="30413">Кой актьор участва в [B]%s[/B] освен [B]%s[/B]?</string><!-- 1st %s is movie title, 2nd %s is actor name -->
    <string id="30414">Кой е най-дългият филм?</string>

    <!-- TV show Questions -->
    <string id="30450">Кой TV сериал е това?</string>
    <string id="30451">Кой сезон на [B]%s[/B] е това?</string><!-- %s is tvshow title -->
    <string id="30452">Кой епизод на [B]%s[/B] е това?</string><!-- %s is tvshow title -->
    <string id="30453">Кога е [B]%s[/B] на [B]%s[/B] излъчен за пръв път?</string><!-- 1st %s is episode, 2nd %s is tvshow title -->
    <string id="30454">Кога е [B]%s[/B] излъчен за пръв път?</string><!-- %s is tvshow title -->
    <string id="30455">Кой играе [B]%s[/B] в [B]%s[/B]?</string><!-- 1st %s is role, 2nd %s is tvshow title -->
    <string id="30456">Кой озвучава [B]%s[/B] в [B]%s[/B]?</string><!-- 1st %s is role, 2nd %s is tvshow title -->

    <!-- Settings strings -->
    <string id="30500">Общи</string>
    <string id="30501">Филми</string>
    <string id="30502">TV Сериали</string>
    <string id="30503">Изтегляния</string>

    <string id="30510">Ограничи броя на въпросите</string>
    <string id="30511">Ограничение на въпросите</string>
    <string id="30512">Ограничи избирането на филмите на база MPAA рейтинга</string>
    <string id="30513">Макс. MPAA рейтинг</string>
    <string id="30514">Показвай правилния отговор, когато се отговори неправилно</string>
    <string id="30515">Използвай само гледаните филми във въпросите</string>
    <string id="30516">Ограничи избора на TV сериали на база Content рейтинга</string>
    <string id="30517">Макс. Content рейтинг</string>
    <string id="30519">Изтегли данни от IMDB</string>
    <string id="30520">Изтеглям данни от IMDB...</string>
    <string id="30521">Получени %d от %d mb.</string>
    <string id="30522">Някои въпроси изискват допълнителни локални данни,</string>
    <string id="30523">които могат да бъдат свалени чрез:</string>

    <!-- Game type strings -->
    <string id="30600">[B]Избери Movie Quiz тип на играта[/B]</string>
    <string id="30601">[B]Избери TV Quiz тип на играта[/B]</string>
    <string id="30602">Неограничена</string>
    <string id="30603">Ограничена по време</string>
    <string id="30604">Ограничена по въпроси</string>
    <string id="30605">Отказ</string>
    <string id="30606">Играй</string>

    <string id="30610">Без лимит по време</string>
    <string id="30611">Без лимит по въпроси</string>
    <string id="30612">Край на играта, използвайки опцията 'Изход'</string>
    <string id="30613">Играта ще приключи след</string>


    <string id="39999">Превод: Пламен Петков</string>
</strings>
